client_name,client_job,review_name,data_review,période_utilisation,comment,avantages,inconvénients,Country,sentiment,label,score;;;
"James,Director (),POS ERP Integration at its finest,il y a 6 ans,  + 1 ans,Definitely consider getting a demo of this app and make sure it's going to meet your needs. Odoo POS is a fantastic option for offering additional functionality to your Odoo ERP.,Odoo ERP is an incredible platform. Their POS makes it very easy to extend our offerings to our stores. All of the functions and features are intuitive and their locations seem to be perfect. It is simple to set up and integrate with the existing ERP infrastructure.,""Their price and customization is the only real downside to this platform. They have great support";" it's more about the fact that there isn't a whole lot of customization options out of the box. The cost seems to be a bit higher than some ERPs out there but, generally much lower than most."",,positive,1.0,3";;
"Parth,Software Engineer (Inde),Change the world using Odoo management,il y a 2 ans,  + 1 ans,""1. It increase my flow of work as well as helps to grow me personally.";;;
"2. Team members can interact easily and hassle free using this platform"",1. Attractive and clean interface for proper flow of work . 2. Ensures 24*7 customer care support which is rare in todays world 3. Wide range of functionality is being provided which increase business growth. 4. Seem-less flow of work with great tools.,1. Application hangs or lag while working for heavy business task thus leads to data loss problem. 2. Its enterprise edition is way to costly as need to pay extra to shift from one module to another. 3. Need some training before working on odoo platform,Inde,positive,1.0,3";;;
"Justin,""VP, Technology (É.-U.)"",You can't do better with scalability for this price,il y a 7 ans,  + 1 ans,Odoo has allowed us to scale users and app usage and continues to be the best bang for your buck. I am glad we made the switch.,""Scale as you need to, start with 1 app and continue to on-board other parts of your organization."",Responsiveness of features from the odoo tech team is timely.,É.-U.,positive,1.0,3";;;
"Utilisateur vérifié,Utilisateur LinkedIn vérifié,Simple project management software.,il y a 6 ans,  6 à 12 mois,It provides a way to manage projects effectively.,""Odoo Projects provides a way to track the progress of a project being worked on by many team members. A Kanban board is provided which aids greatly in determining the current state of tasks, alongside individual task information."",""Out of the box, there is very little options or customisation within the 'project template' itself. For example, I am unable to add a field to specify the type of task (a 'custom field') without installing another plugin."",,positive,1.0,3";;;
"Utilisateur vérifié,Utilisateur LinkedIn vérifié,Excellent Software,il y a 4 ans,  + 1 ans,""odoo is an excellent system that integrates all areas of the company in the same platform, ideal for growing companies."",""What I like most is that it is an all-in-one system, very simple and flexible for any business operation."",""The only thing that is lacking is the need to always have internet, without connection you cannot do your daily activities."",,positive,1.0,3";;;
"Sam,Founder (É.-U.),Experienced Odoo user,il y a 7 ans,  + 2 ans,""Experienced user of every major odoo application. From the CRM to the Manufacturing quite, I have used odoo in many real world scenarios. I have built ERP instances for multiple industries and companies. Odoo is easy to us, run by people who have a genuine interest in making ERP for the masses in a scalable modular way that saves 100's of thousands vs top heavy behemoth versions from some of the bigger names. The focus is on clean UI with powerful easily deployed instances. I've used the CRM for my own project at www.relayo.com where we used it to onboard 1000 users."",""Ease of use, material designed UI, modular."",Need a bigger customer service presence in the US,É.-U.,positive,1.0,3";;;
"Angel,Delivery Manager (Argentine),One of the most complete solutions in the market.,il y a 6 ans,  + 1 ans,""Thanks to Odoo we can integrate all the departments into a single platform, easy to use with minimum training."",Easy to use and integrate with other softwares. Fast interface and very easy to customize. Excellent!,The help desk module and the project module need more development and can be more helpfull if you can use an email interface on Help Desk.,Argentine,positive,1.0,3";;;
"Luis Raul,Co-Founder (Mexique),Good Open Source ERP,il y a 6 ans,  6 à 12 mois,I am using Odoo for generate budgets to my customers in base to my service inventory.,""If your company has a lot of processes defined and has many employees work together then you need Odoo for manage all your processes. You can have CRM, project management, sales and inventory tool and more."",""You need have high python skills if you are the person who will implement it, besides you need learn a lot of terms and read documentation to customize the platform."",Mexique,positive,1.0,3";;;
"Giulio,Director (Mexique),Malísimo,il y a 2 ans,  + 1 ans,No me sirve para nada dinero tirado a la basura,""Una vez probado solo que esta en la nube,"",La atención y el servicio y por ejemplo facturación no cumple con los requerimientos del SAT en -México y a la gerente de Mexico le vale todo lo que le expresado.,Mexique,negative,-1.0,3";;;
"Alfredo,Project Manager (Espagne),""I'm an user of the program, I use it in my office as our ERP, v8 overall is great."",il y a 6 ans,  + 1 ans,""new ways to understand business models, new professional tools because it a very popular software now a day."",The UX design is very simple The default features covers a lot. It's customizable by coding. the price.,""It isn't a great tool for a non-common business model. It depends on the data base, so if you have a lot of info it lags."",Espagne,positive,1.0,3";;;
"Juan,Quality Manager (Mexique),Odoo review,il y a 5 ans,  + 1 ans,I run into a few problems but overall good,I like the simplicity in which you can do most stuff,""The way that you need to import all the information at first otherwise it's difficult to associate accounting movements later on, and nobody tells you this"",Mexique,positive,1.0,3";;;
"Utilisateur vérifié,Utilisateur LinkedIn vérifié,Mi solución,il y a 2 ans,  Essai gratuit,Me facilita el manejo de mi empresa,""Con Odoo manejo muy bien mi negocio con aplicaciones sencillas y fáciles de entender y utilizar, para cada necesidad de mi empresa. Aumentar en las ventas, integrar mis servicios, optimizar mis operaciones,hacer mis citios web, manejo de mi contabilidad, automatizar mi marketing, personalizar mi estudio y mucho mas. En las aplicaciones Odoo hay una comunicación integra que permite cosechar los ahorros y beneficios. Odoo automatiza el acceso de localización a cualquier dispositivo integrando todas sus aplicaciones. Su diseño es técnico moderno y agradable con una facilidad de usabilidad. Todas sus mejoras se aplican automáticamente."",Todo me gusta por su facilidad al manejarlo.,,positive,1.0,3";;;
"Jose,2nd level operations (Venezuela),""Odoo, the easiest way to develop your ideas"",il y a 6 ans,  + 1 ans,Creation of a data center interconnection registry application,""you have the option to create your own python based application And if you want you can use one of the many applications already published and start to shape it to your business needs Sales applications, calculations, inventory, among others. are the options that odoo gives"",""Being an open source CRM, you must have knowledge in programming, servers and implementation of applications."",Venezuela,positive,1.0,3";;;
"Allan,Head of Information Security (Australie),A great open source ERP platform,il y a 11 heures,  6 à 12 mois,""It was great, good job to the Odoo team!"",""It was one of the best Open Source tools we've found, feature rich and actively updated"",""The few times we needed support it wasn't cheap, however those were few and far between"",Australie,positive,1.0,3";;;
"Christine,Director of Operations (É.-U.),Odoo is a great alternative,il y a 2 ans,  6 à 12 mois,""I enjoyed using Odoo in 2021.";;;
They have tons of tutorials.;;;
"Access to experts and a knowledge base for just about everything you need."",""I love that multiple users can use Odoo and that it had many dimensions. Use what you need, don't pay for what you don't need."",I wish their financial statements were easier to format in the community version.,É.-U.,positive,1.0,3";;;
"Utilisateur anonyme,""Construction, 11–50 employés";;;
Temps d'utilisation du logiciel : 6 à 12 mois;;;
"Source de l'avis"",Modulos de Odoo,l’année dernière,  6 à 12 mois,""Al comienzo no fue fácil ya que no estaba al corriente con este software, pero poco a poco adquiriendo experiencias y practicando se me ha hecho una interfaz agradable."",""Que tiene muchos módulos , hasta puedes crear módulos para tus propios beneficios"",""Que siempre hay actualizaciones del software, no digo que este mal solo que los cambio no mínimos en los módulos, si se va a realizar actualizaciones, que al menos sean cambios grandes"",,positive,1.0,3";;;
"Dani,Sales and Marketing Ninja (É.-U.),Odoo Review,il y a 5 ans,  6 à 12 mois,""Would love to have an Odoo specialist on hand to make this an intuitive and reliable software to work with. As of now, it leaves a lot to be asked for."",I like that it can be customized -- too bad I and my colleagues are not in a functions to customize it.,""I don't like to query 5 times (same exact query/filtering option) to have it work. There are many aspects that are not user-friendly, although this could be as a result of how it has been customized to meet our organization's needs."",É.-U.,positive,1.0,3";;;
"Erik,Change consultant (Pays-Bas),Free to use but way to complex for beginners,il y a 4 ans,  6 à 12 mois,It took a lot of effort to get this software and all needed options up and running. After a while we had some missig financial info and we where not abe to fix this so finally we stopt using the software after one year.,""The software is free to use for small companies, installation was not very complex but some IT knowledge comes very handy. A lot of plugins re available via build-in and more plugins are available via external developers."",""System is way to complex for beginners, when you want to use this software use a consultancy company to set this software up for you. Localisations are available for a lot of different countries. The reporting options are also complex and I found it difficult to get the correct financial reports out of this system. Finally stopt using this software and bought some more simple software"",Pays-Bas,negative,-1.0,3";;;
Utilisateur vérifié,Utilisateur LinkedIn vérifié,simple and easy ERP,il y a 5 ans,  + 1 ans,i'm overall satisfied with the system,unlike other crm in the market the deployment of odoo does not require a lot of equipement we can instal it in a synology nas depending of the models and the use,the comunity of user is not big its not easy to resources and solutions in the internet,,positive,1.0,3;;;
"Karol,CEO (Slovaquie),The beginning,il y a 4 ans,  Essai gratuit,""We can solve everything in odoo, from purchase planning to customer service and e commerce."",The fully integration is really great. Not needed to use other software.,The configuration and setup is not easy.,Slovaquie,negative,-1.0,3";;;
"Anand,Program Manager (Inde),Best app to time tracker and lead management!!,l’année dernière,  6 à 12 mois,Very nice! It needs training before on boarding. We can set up the application as per our needs! It has lots of options and a project can run through this!,""Best application for time tracker of individual/team members and projects. However, it needs tech-savvy while setting the application in starting as per our need!"",User interface is quite difficult but once sets up the application then we can manage it!,Inde,positive,1.0,3";;;
"Dakotah,Customer Service Rep (É.-U.),Pretty Easy,il y a 7 ans,  + 1 ans,""Odoo has been pretty east from my point of view. I have nothing to complain about, but I am also not the person that is paying for it. It is easy to access, and maneuver around things for what we use it for."",Easy to move around in,I personally do not have nay complaints,É.-U.,neutral,0.0,4";;;
Utilisateur vérifié,Utilisateur LinkedIn vérifié,Un software de presupuestos bueno pero no el. Mejor,l’année dernière,  1 à 5 mois,En general me parece bien para empezar pero no tiene tantas herramientas y no es tan fácil de usar.,El software me parece que tiene varias funciones y te permite cotizar todo de manera rápida por ende puedo ahorrar tiempo incluso si presionas en la casilla del lado izquierdo suma el valor total del presupuesto de cada cliente.,No me gusta que su buscador es básico y muchas veces no me permite encontrar los nombres de mis clientes de manera rápida. Además sería bueno que se guarde cada cliente y dentro de estos cada una de las cotizaciones y no por separado. Me gustaría arrastrar el mouse y que vaya sumando directamente. No es tan fácil de entender el software pudiera ser más dinámico o intuitivo. Es un poco básico y anticuado.,,positive,1.0,4;;;
"Utilisateur vérifié,Utilisateur LinkedIn vérifié,""I have been working whit Odoo since a year ago, it is a great ERP."",il y a 6 ans,  6 à 12 mois,I´m working in the implementation of this Software for others companies,""You can configure it to adapt to your company and process, there is a lot of information in the web, forums, even youtube videos"",""It is not easy of understand if you are not related to a previous experience whit another ERP, there is not a unique price for the enterprise version"",,positive,1.0,4";;;
"Tanveer,Partner (Pakistan),Modern ERP,il y a 4 ans,  1 à 5 mois,""Its brilliant, having experience with few ERPs in my 20 year career i found Odoo is the best."",Its using modern technology and easy to use,""the range of modules Odoo have, it almkst conering every sector."",Pakistan,positive,1.0,4";;;
"David,Plant / Operations Manager (É.-U.),Most Bang for your Buck,il y a 5 ans,  1 à 5 mois,""Our company was using Netsuite which cost way more than we needed. Switching to Odoo has allowed us to cut our ERP expense by around $20,000 per year."",""The modular approach that Odoo takes makes it very easy for our company to fit it to our needs. It is very easy to use on a tablet as well, which helps me a lot when I am out in the plant and not at my desk."",""The finality of transactions. If a transaction is validated or confirmed, it is all but impossible to go back and make a correction if an error occurred. Even things such as a sales order being entered and needing to be corrected, before it ever has shipped out, causes an issue. I truly wish that they would come out with a fix to this."",É.-U.,positive,1.0,4";;;
"Giuseppe,sales manager (Italie),Forse adatto per il mercato straniero,l’année dernière,  Essai gratuit,""Abbiamo deciso di provare Odoo insieme ad altri software della stessa tipologia in quanto in cerca di un nuovo software gestionale. A primo aspetto è sembrato molto pratico, funzionale e completo.";;;
"Provandolo però ci siamo accorti che è carente in molte funzioni soprattutto quelle fiscali ed amministrative italiane. Il software è molto macchinoso e sommando il costo dei moduli a noi necessari avremmo speso molto di più rispetto a software top di gamma realizzati da produttori italiani per il mercato italiano. Alla fine abbiamo scelto altro."",""Purtroppo non sono rimasto entusiasmato dal prodotto anche se graficamente è funzionale, si presenta bene ed è molto pubblicizzato."",""Troppo macchinoso, lento, moduli aggiuntivi costosi. Poco adatto per il mercato italiano, soprattutto per quanto riguarda la parte fiscale e normativa."",Italie,negative,-1.0,4";;;
"Ea,Brand Manager (Philippines),Highly Versatile,il y a 4 ans,  1 à 5 mois,""The versatility was very essential for us in looking for a system that will work from end-to-end. ALthough it really got messy on the technicalities, it was able to tailor-fit into our needs."",""Very customizable and adaptable to the requirements of our business. Given that our services is a hybrid and has a unique process flow, odoo was able to put the right pieces together"",""Too technical when setting up. Best if the core team who would the adhoc has a brief understanding of coding even if they are from marketing, sales, or other dept. to fully communicate what needs to be done"",Philippines,positive,1.0,4";;;
"Utilisateur vérifié,Utilisateur LinkedIn vérifié,Odoo accounting system review,l’année dernière,  6 à 12 mois,""for small to medium business its the viable option to manage all the accounting process, crm , projects , timesheets"",Its affordable to purchase and implementEasy to integrate with payment gatewaysEasy to integrate with internal systems,user interface isnt modernfew templates for invoicing and quotations,,positive,1.0,4";;;
Utilisateur vérifié,Utilisateur LinkedIn vérifié,Best ERP for small and medium companies,il y a 5 ans,  + 1 ans,Very productive tool for my companies,A lot of functionalities in one platform,There are a OpenSource version it could confuse a customers,,positive,1.0,4;;;
Hesandu,Manager (Sri Lanka),A brilliant ERP software....,il y a 3 ans,  6 à 12 mois,We used Odoo for more than 6 months. It was our primary ERP software. A great software. We used it for managing our business.,A good ERP software. This software has every module of a business management software. Very easy to use and learn. Easy to customize. Lot of features and very easy to install. Excellent software.,I didn't have any issues with this software. A great software.,Sri Lanka,positive,1.0,4;;;
Jose,Owner (République dominicaine),Very good POS,il y a 5 ans,  6 à 12 mois,I used odoo community version which is different from Odoo enterprise (dont know at what point),- simple -Has pictures and available stock in real time and easy to spot -works offline (for a cirtain period),- Some things need to be added like the cash bills at the moment of closing the POS (at least in community version) -For me the returns were getting glitchy and wasnt able to do returns for 3days+ reciepts,République dominicaine,positive,1.0,4;;;
Valentina,Accounting (Espagne),Very good and cheap,il y a 9 mois,  6 à 12 mois,Human resources at my job,Is very easy to use and at the same time cheap,The attendance mostly is late and you have to wait,Espagne,positive,1.0,4;;;
"Joel Neil,Specialist Recruiter (R.-U.),Good features,il y a 5 mois,  6 à 12 mois,""We integrated the product on our time with a project with Google docs, worked fine."",""All in one product, has a main customisable home page that lets you see whatever you need to see, such as tasks, pending approvals etc. Does have its own schedule and also can integrate with your other schedules which is a nice feature to have."",""The product has been mainly used by small companies, or sometimes small and should adapt to work with large and world wide companies with different entities."",R.-U.,positive,1.0,4";;;
"Corey,Medical Director (Canada),Beware of Empty Promises,il y a 3 ans,  1 à 5 mois,Would never recommend again. No flexibility and complete emptiness in functionality even after promising they could deliver.,Customer service initially was good. Our technician was helpful until the point they realized our needs could not be met.,""Be weary of empty promises. Retained Odoo for an EMR buildout after we were PROMISED they could deliver on our needs. Upon further interaction we realized these needs could not be met. Not only were we not refunded for the hours we had actually utilized, they refused to refund us any of our unused retainer. If you want to say goodbye to huge sums of money very quickly with no usable product by all means, retain Odoo. Will not refer nor will I be engaging them again in the future."",Canada,neutral,0.0,4";;;
"Enrique,Project Manager (Espagne),""Open Source Code, your best friend"",l’année dernière,  6 à 12 mois,""Although at the beginning it does not seem the most viable option, in the medium term it ends up being the best ally to control all the variables of an ecommerce."",""Odoo's open source code makes it easy to cover all business needs: CRM, product tracking and so on."",The learning process is long until you manage to integrate all the necessary tools.,Espagne,positive,1.0,4";;;
"Tunde,Partner (Afrique du Sud),fantastic tool to manage Enterprise business,il y a 7 ans,  6 à 12 mois,Good accounting solution,It had all sorts of apps and also supported by a large community of many different apps to cater to certain niche processes. besides the community edition is free and that is a great benefit,""can only be modified in Python for community edition, also the cloud version does not allow too much flexibility to customise things like payroll"",Afrique du Sud,positive,1.0,4";;;
"Assimi,Marketing and communication director (Burkina Faso),Easy to use,l’année dernière,  + 2 ans,Fantastic,""Like many of the best programs, odoo has an intuitive and easy-to-use interface. It has the ability to integrate with many applications such as social networking sites. This software can't not be good"",Odoo is also expensive since it is good so it is worth the price. It also has bugs sometimes. I don't know if it's only with me.,Burkina Faso,positive,1.0,4";;;
Nilesh,Odoo Developer (Inde),User friendly and easy to use,il y a 4 ans,  + 1 ans,I have been solved many business problems using odoo.,It is easy to use and improve the business functionality.,It is easy to understand the business flow.,Inde,negative,-1.0,4;;;
Utilisateur vérifié,Utilisateur LinkedIn vérifié,The Best Erp i ever used,il y a 2 ans,  + 1 ans,I have created a phone book with,quite easy to set in place and to use .,sometime the support team is not diligent,,positive,1.0,4;;;
"FRED,Production Manager (Canada),Great software for small teams,il y a 5 ans,  + 1 ans,I’ve been pretty happy with the value I am getting.,Ease of use. Great support from our implementation consultant.,""Lack of complex functionality, especially with manufacturing and co-packing functionality."",Canada,positive,1.0,4";;;
"Permana,Backend Developer (Indonésie),A lot of features,il y a 5 ans,  Essai gratuit,""Was installed it only for testing purpose, to see if it suit client's requirements.";;;
"It has a lot of features, but was too expensive for client's budget."",""Has a lot of features. Modular, and open source."",Pricing is too expensive if you use a lot of apps. Open source version lacks of useful features.,Indonésie,negative,-1.0,4";;;
"Adam,Accountant (Jordanie),The leader of open-source ERP,il y a 9 mois,  Essai gratuit,I think Odoo will be one of the best ERPs. Open-source and Python will give it the power to be the best.,""Odoo uses a modular design that enables us to select and implement only the necessary components. Because of this flexibility, organizations can start with basic features and gradually add more as their needs change."",""The main issue with Odoo is complex pricing. Switching to additional apps increases the billing, causing confusion and higher costs."",Jordanie,positive,1.0,4";;;
"Lucy,Software Developer (É.-U.),Group of multiple app that you can find your need,il y a 4 ans,  Essai gratuit,""Great customized group of apps. We can pick Employees, Timesheets apps for HR department, Invoicing app for Accounting department, and so on. Some custom fields can be used to fit individual group need."",""They provide all apps that can use for a company's different department used. Best thing is that it's easy to set up the web pages for company customer facing website, also for the internal invoice templates used. Hover the label, tooltips helps a lot to explain the field is using for."",""For Inventory app that they don't have a way to upload multiple photos to the product. When we want to upload the skid size, Odoo doesn't have width, length, and height options for us to enter and do the calculation."",É.-U.,positive,1.0,4";;;
"Pitchaya,CEO (Thaïlande),Working with Odoo is easy and it's flexible.,il y a 7 mois,  1 à 5 mois,Feel good about the flexible system. But it's not good in that it pays attention to customers. and new visitors,""Working with Odoo is easy if you've used other ERPs before, Each Features have a similar face Most of my employees say it confuses them sometimes."",After paying extra for support Odoo changed the importance of the customer. as a user I'm sure that in a few years If there is no change my company must stop using Odoo services.,Thaïlande,negative,-1.0,4";;;
"Austin,Software Analyst (Argentine),""Odoo, your bow and arrow for success"",il y a 6 mois,  1 à 5 mois,""We started using it as a Project Tracking tool, and now we added IT Ticketing integration, and we made a professional ticketing system work in less than 1 week, so every solution you get from them is exceptional, we're in awe and will continue to add more solutions."",""I think the best thing about Odoo is the ease of use, and the facility of integration with your current systems, we're starting to use it and add different tools, but there are so many ! You can integrate every software you can imagine and there are predefined integrations, making it so much simpler."",""I think Odoo could make a Freemium tier more inclusive and let you see what they really have to offer, the possibilities are so many that sometimes it can be difficult to locate your best choice. But I'd say that is not a bad thing, just a choice you have to make."",Argentine,positive,1.0,4";;;
