client_name,client_job,review_name,data_review,période_utilisation,comment,avantages,inconvénients,Country,sentiment,label,score;;;
"it is like a very good framework. for everything, but as far for nothing, because to adopt to real customer story you need big background of understanding how it works and need quite big implementation of programing things (custom developments)."",good out of the box framework. good dependencies per all modules.,still very lack of detailed solutions. very poor support of partners. very bad deep understanding of overall solution in odoo (as main provider). also - pricing not competitive to markets (like what is normal price in Belgium is not normal in Lithuania).,Lituanie,positive,1.0,5";;;
Utilisateur vérifié,Utilisateur LinkedIn vérifié,Odoo- An opensource CRM,il y a 4 ans,  + 1 ans,We use Odoo to track and manage our leads. We also provide Odoo customization services to our various clients.,It is opensource and free to use and customize to our needs. Most or all of the features are free to use and the number of users are unlimited.,The user interface and experience should be a bit better. It looks pretty bland straight up. But its alright given the software is free to use and customize!,,positive,1.0,5;;;
Weston,Senior business development manager (É.-U.),Odoo is a waste of money,il y a 2 ans,  + 2 ans,Horrible,Not user friendly and not happy due to it not saving critical notes and info.,Not user friendly and if you have two tabs open nothing will save. Horrible crm and would not recommend to anyone.,É.-U.,negative,-1.0,5;;;
"Marek,CEO (Pologne),Odoo Review,il y a 9 mois,  Essai gratuit,""Overall, my experience with Odoo has been positive. The software provided a comprehensive suite of tools and modules to effectively manage various aspects of my business. The ability to customize and tailor Odoo to my specific needs allowed me to create a personalized and efficient workflow. The availability of regular updates and improvements from the Odoo community ensured that the software remained up-to-date and responsive to evolving business requirements. While the initial setup and learning curve posed some challenges, the benefits of using Odoo outweighed these minor inconveniences. The continuous support and active community made it easier to find solutions and troubleshoot any issues that arose. In summary, Odoo has been a valuable asset in streamlining my business operations and improving overall efficiency."",""One of the things I liked most about Odoo was its modular and customizable nature. The software offered a wide range of modules and apps that catered to various business needs, such as CRM, accounting, inventory management, project management, and more. This flexibility allowed me to tailor Odoo to suit the specific requirements of my business. Additionally, the user-friendly interface and intuitive design made it easy to navigate and use the different modules. The availability of a large community and marketplace for additional modules and integrations was also a major advantage."",""While I found many positive aspects of Odoo, one thing I liked least was the complexity of the initial setup and configuration. As Odoo offers a vast array of features and customization options, it required some time and effort to properly set up and align the software with my business processes. Additionally, the learning curve for users who were new to the system could be steep, especially for those without prior experience in using ERP or business management software. However, with proper training and support, these challenges could be overcome."",Pologne,positive,1.0,5";;;
"Utilisateur vérifié,Utilisateur LinkedIn vérifié,Not useful for anyone other than clothing sales,l’année dernière,  + 1 ans,""Worked with all of them (SAP, Dynamics, Netsuite, Sage, Epicor, etc) and it is by far the least functional, but very """"pretty"""""",""It has a pretty interface. I have to say more to have this valid, but I really cannot think of anything else """"nice"""" to say about the product."",""No ability to do journal entries, their is no relations between apps, half of the functions don't work, requires extremely extensive customization to do the simpliest tasks. Features are not consistent between sales and purchase (ie has blanket purchase order, but no blanket sales order among pretty much every feature). Useless manufacturing app (impossible to set-up work centers or maintain BOMS or any PLM)"",,positive,1.0,5";;;
"Sonia,General Manay (É.-U.),Worst service!,il y a 12 mois,  6 à 12 mois,""We have a lot of error that the program presented, nobody take care of our problems. We received the worst service! Our experience it is awful!!!"",""Nothing, right now I’m completely frustrated about the program!"",The service. It is the worst service I never have!,É.-U.,negative,-1.0,5";;;
"Mariel,Project Manager (Espagne),Solución ERP integral y adaptable con margen de mejora,il y a 10 mois,  1 à 5 mois,""Descubrí que el software brindaba una solución robusta y flexible para administrar mis operaciones comerciales. Aprecio el nivel de personalización y escalabilidad que ofrece Odoo, lo que me ha permitido adaptar el software a las crecientes necesidades de mi negocio."",""Aprecio especialmente la amplia gama de características, que incluyen contabilidad, gestión de inventario y CRM. El soporte de múltiples monedas y la importación automática de fuentes bancarias me facilitan la vida mientras administro mis transacciones comerciales globales."",""Me di cuenta de que la atención al cliente a veces puede tardar en responder a las consultas, lo que puede ser frustrante."",Espagne,positive,1.0,5";;;
Taha,Civil Engineer (Italie),Odoo - Una piattaforma completa per lo sviluppo aziendale,il y a 11 mois,  + 2 ans,Odoo offre un'ampia gamma di sistemi che servono ogni area di un'azienda. La sua struttura modulare consente agli utenti di scegliere le app adatte dall'app store.,Odoo è un'eccellente piattaforma per costruire la logica aziendale sul suo server delle applicazioni.,L'installazione e la configurazione possono essere difficili e per comprendere il sistema sono necessarie competenze di programmazione. Questo può essere frustrante e costoso per le aziende.,Italie,positive,1.0,5;;;
Jason,Electronics Engineer & IT Specialist (R.-U.),A fully featured platform - does require commitment to implement,il y a 4 ans,  + 2 ans,We are using Odoo to track inventory and process manufacturing operations. It does not quite do everything that I need but the level of customisation available does mean that if something becomes important I can fire up the development environment and extend.,Odoo has a very broad set of features and capabilities that with the correct implementation enable automation and efficiency in many areas of business.,There are almost too many features available - at least it can feel like this when you first install and get a system up and running. Depending on your business setup and existing workflows you will need a lot of tweaking and customisation to get things working in a way that maps your real-world workflow.,R.-U.,neutral,0.0,5;;;
"Dayana,VP SALES (É.-U.),Cheaper always comes at a cost !,il y a 7 mois,  1 à 5 mois,""its been frustrating. it has its positives for sure, which is why i am using it, but the customer service aspect is really a hinder to making this system a 5 star company."",""That it was cheaper and afforable compared to other systems, and that as my business grows i can grow with it."",""The customer service is horrible. You have 0 access to people on the phone, its ONLY by email, that you the system doesnt work with square, that the person who sold me the product, did not explain everything correctly to match my business needs, that there are glitches with the system that sometimes requires an internal odoo developer to fix, that you have pay for implementation but that there its no first free training based on your company needs. The worst is not being able to talk to someone. You are getting Bills that noone can answer you the details of those bills. if you have all the money in the world, to put in implementation, but even then, you may not get all your answers."",É.-U.,positive,1.0,5";;;
"awogor,Editor In Chief (Nigeria),Best for business Management CRM and Marketing,il y a 5 ans,  + 1 ans,""Odoo is overall the best CRM software to manage all your businesses in one place including invoicing, marketing, management etc."",""Odoo is an all in one business software that is comprising of CRM, billing-invoicing, accounting, Email Marketing, manufacturing, website/e-commerce, warehouse - and project management, and inventory and many many more which has been providing value at an extremely affordable price. The software is so broad that you can manage your business all in one place including email marketing, e-commerce solutions and more. It comes with both enterprise and free."",Odoo is technical to setup. I could have got lost when I signed up but I sorted some YouTube tutorials which got me back in the lane.,Nigeria,positive,1.0,5";;;
"Michel,Sr. Operations / Projects Manager (Pays-Bas),All in One Software running your business,il y a 5 ans,  6 à 12 mois,In short we feel we have selected the right solution which we can use for further growth and extend when needed.,""With Odoo we were able to replace our tools for CRM/Sales, Project Management, Logistics, Warehousing, Purchasing, Repairs, Marketing, Support, HR, Finance and we even created a custom CMDB with the Studio module (friendly programming module). Since all the data is now stored in a single database, users can easily navigate through the system and gain the required insights. The users love to work with it and the free Odoo training portal gave the users the right content to improve their daily workflows."",""Almost everything is possible, Odoo provides the largest business app store, what we were missing could easily be added via modules or add-ons. Aldo for Field Service Management we have selected another application. In Odoo v13 (next release) the FSM is covered."",Pays-Bas,positive,1.0,5";;;
"Utilisateur vérifié,Utilisateur LinkedIn vérifié,Performance and errors in product,il y a 5 ans,  + 1 ans,Great experience if you don´t have malfunctions in your system,""Functionality, easy of use, the product is open source, very easy to add new functionality. Security is great."",""Many errors in Multi Company, bad interface between electronic accounting from México and multicompany functionality. Hard to develop reports, the product need a similar as Crystal Reports from SAP. You can do a lot of things with the product but there is not enough technical documentation."",,negative,-1.0,5";;;
"Alberto,Tecnico (Italie),Ha ancora molta strada da fare,il y a 11 mois,  6 à 12 mois,""Abbiamo attivato Odoo grazie al prezzo competitivo e al canone per utente. Utilizzandolo, si è rivelato molto complesso da configurare, con pochi tutorial e con un servizio di assistenza spesso assente. Questo per un'azienda che lavora quotidianamente con un gestionale è una cosa non accettabile. Essendo un software straniero e open source purtroppo è abbastanza generico e manca di specificità per la nazione in cui deve essere utilizzato soprattutto per la contabilità. Alla fine abbiamo optato per altro prodotto."",""interfaccia utente intuitiva, caricamenti veloci e possibilità di gestire più lingue."",Presenza di alcuni bug che per un software di questo genere dovrebbero essere già stati risolti. Tempi di risoluzione delle problematiche riscontrate molto lunghi. Servizio di assistenza spesso assente e molto lento.,Italie,negative,-1.0,5";;;
"Nate,President (É.-U.),Amazing breadth of functionality. Great support from Odoo partner.,il y a 7 ans,  + 1 ans,""Broad functionality, full integration, and high extensibility in a low price tag."",""Amazingly broad set of applications. Everything from crm and sales management to inventory and MRP in one application, on one database. Everything is extensible."",""Upgrading to new versions is terribly painful. In fact, it is often easier to back port functionality in a new version to a previous version. Odoo SaaS version is not good. Partner approach is better"",É.-U.,positive,1.0,5";;;
Garrett,IT Manager (É.-U.),Great Value - Not a full package,il y a 7 ans,  + 1 ans,We have found customer service to be good! The software is pretty intuitive by ERP standards (most ERPs are horribly unintuitive) and mostly mobile friendly. The price is unbeatable in this software class.,Good interface Good improvements Good customer Service Fast workflow,Little mobile support Updates crash the software sometimes Urgent issue response time unreliable Missing common features,É.-U.,positive,1.0,5;;;
"Ana Paula,Environmental Consultant (Pérou),A free and effective software for management,il y a 5 mois,  + 1 ans,""For a relatively small company we find its use favorable, low implementation costs and it also helps to effectively manage the customer portfolio."",""The fact that it is free is the most important thing. In addition, its CRM module allows you to effectively keep track of current and potential customers, not to mention its use as a manager that allows you to plan in a well-structured way."",""For a small company there are no complications, except for support costs. But for large companies the processes could be delayed when handling an amount higher than their margin."",Pérou,positive,1.0,5";;;
"Slim,Odoo & Web Consultant (Arabie saoudite),Odoo allows integrating ERP in just few hours or days,il y a 5 ans,  + 2 ans,Using Odoo we and our customers can track & manage a large amount of the enterprise daily work operations and with a very simple and straight forward user experience.,""Odoo has allowed SME's to aqcuire and integrate ERP system very fastly and at a very low cost. It also offers very simple and clean operations that handles a huge amount of enterprise daily work such as CRM, Sales, Accounting, Inventory and many other operations. Odoo also have a very large community that enriches the system with a huge number of addons & extensions."",With the paid enterprise version you have to pay for apps that are already included in the free community version.,Arabie saoudite,positive,1.0,5";;;
"christophe,consultant (É.-U.),Bug in POS and basic features missing,il y a 4 ans,  1 à 5 mois,""Overall I still can't make my mind if I am satisfy.";;;
I have setup the system for my client after a quick demo and test it for a week maybe, BUT step by step I discovered many bugs , and wrong behavior and nothing has been done yet to solve it.;;;
I opened ticket with the support team, It says maybe in the v13, but that mean I have to wait for 6 months at least.;;;
I checked this morning the new version v13, and some of the bugs have not been solved so far in the v13, so really upset and disapointed about that.;;;
I have spend so many hours/days debugging talking to the support, and I had nothing in return.;;;
"So I will say it is a ok product as long as you don't use the POS app."",""I feel like this is a good software overall despite the POS system. Otherwise it is a good software, with a lot of good things but also so many basic features missing and small bugs unsolved."",""POS is too basic and so many bugs. for instance, taxes is not updated after applying a global discount which is totally illegal. Promotion and coupon are not available in the POS, not boing able to send receipt per email or seeing the receipt history from the POS... Some missing indicator for the POS, such as margin, average basket... I made a list of thing which can be improved and bugs, I'll be happy to share it with you if someone contact me to talk about that."",É.-U.,negative,-1.0,5";;;
"Karen,Auditor superior (Venezuela),""This software offers a project management platform, very friendly and organized. Easy to use."",il y a 6 ans,  + 1 ans,""It is an excellent option to follow the projects, the management of the company changes to implement this tool as an instrument of control and monitoring of results."",""It allows me to monitor my work and personal projects, in a very simple, organized and fast way. It helps me optimize the use of human and financial resources. Fulfill my objectives and goals in a timely and effective manner. In my company, it helps me to follow up on the tasks of the work team and allows excellent presentations on the progress of the various projects."",""the report generator engine could be improved, extracting the information to make presentations becomes a bit tedious and complicated. When learning to do it, it is very simple."",Venezuela,positive,1.0,5";;;
"Utilisateur vérifié,Utilisateur LinkedIn vérifié,Benefits of using Odoo,il y a 11 mois,  6 à 12 mois,""For me Odoo is very useful especially with the nature of my Job because I do have a lot of Business Trips and Meetings. It helped me a lot in easily setting me schedule. Also, my bosses will already be informed and can monitor what I am doing without me telling them because they can already see it in my calendar."",""What I like the most in using Odoo is that it's very easy and convenient to set your schedule, just like for example when you have a scheduled courtesy visit with your clients, business trip and other business meetings. Also, you'll have a schedule alignment with your workmates because they will be able to know if your busy or not by just by looking at your Odoo Calendar."",I did not see anything wrong with using Odoo.,,positive,1.0,5";;;
"Mariel Andrea,Contadora (Mexique),Es buena herramienta cuando se tienen las diversas aplicaciones,il y a 2 ans,  + 1 ans,""Es buena, un poco cara pero bastante útil"",""Me gusta la flexibilidad de crear, diseñar, importar y exportar información dentro del crm y facturación"",Creo que le falta un poco de actualización a la interfaz,Mexique,positive,1.0,3";;;
"Serag,GM-CTO (Égypte),The future of ERP,il y a 5 ans,  + 2 ans,""We implemented, consulted & trained several businesses in different industries through 5 years, so we are very well experienced with the system. Also iam V12 certified concultant."",""We are Odoo Certified Silver Partner in UK and Egypt. Odoo is largely expanding in several regions we serve. The ease of use, logic, and advanced apps in have Odoo provided business a one tool for all their business technology tools needs. This is a revolution in ERP systems."",""Till now, i cant find anything to not like in this robust system."",Égypte,positive,1.0,3";;;
"Kirby,CEO (É.-U.),""More like """"No-doo"""" or """"O-don't"""""",il y a 5 ans,  + 1 ans,My experience is that Odoo's team is nice but they should be pretty embarassed that they trying to market this software to manufacturers. Some of the workarounds they suggested were completely rediculous. Even trying to pull basic data out of the software typically involved creating an excel export and then manually calculating the info I was seeking. We also occassionally had to export data from two different exports and manually merge the data. This software is atrocious and I'm not sure I'd wish it on my toughest competitor.,I liked that it runs in a browser. The pivot table reporting is pretty cool but less useful than we originally anticipated.,This software is terrible for manufacturers. It is nearly impossible to figure out the status of something in the software. Getting inventory valuations at a previous point in time is an extremely difficult process with this software.,É.-U.,negative,-1.0,3";;;
Tahir,OPERATION AND CUSTOMER SUPPORT (Émirats arabes unis),Super Things for Odoo,il y a 11 mois,  + 2 ans,We are getting our all ledgers in one place with security and also our all data with all customer record available very safely,I mostly like that you can entertain more than one customer at one time in POINT OF SALE and mostly you can easily operate this software comparitively to other softwares,The least thing is we can not return our order once it's posted in point of sale sessions,Émirats arabes unis,positive,1.0,3;;;
"Carlos,RPA Developer (Brésil),Odoo made project management easier.,il y a 2 ans,  + 1 ans,""Integration with other tools is excellent. The experience with Odoo is pleasant and easy from entering data, organizing and controlling them, creating deadlines, alerts and notifications and alarms. It is possible to export the data to later analyze it more precisely and create presentation graphs."",""Odoo software has improved our organization, planning and work routine. Everyday projects and activities are recorded in the tool that has cloud management. We use it on our workstations and also on Android devices with the official APP. The system of alerts and notifications always helps us to remember the activities and the most critical and urgent ones."",Odoo on android has some instabilities and crashes. I prefer to always use via the web and on Windows.,Brésil,positive,1.0,3";;;
Khaled,DIRECTOR GENERAL (Égypte),Review from a CEO perspective,il y a 4 ans,  6 à 12 mois,It’s the best software I have had so far for managing my company.,Reports are very fluent and easily changed to meet the needed inquiry.,Payroll localization needs to be improved. I understand that you guys worked on Belgium first but most countries don’t have this level of complexity.,Égypte,positive,1.0,3;;;
"Sunil,Director (Malaisie),Don’t use Odoo – You will regret,il y a 2 ans,  1 à 5 mois,""After having a long conversation with Odoo support, the Odoo CS proposes a set of apps for my business. Tells me that these apps are good enough for all my business operations. During the trial, I found out the app was lacking few features and the process was complicated. I get assurance from them that they have a solution. Based on faith, I signed up for their annual package. However, they couldn’t provide me with a proper solution for consignment inventory and proposes a “workaround” which doesn’t work for my business. Then comes the bombshell. They entice you with the cheap apps only for me to find out I need another app call “Studio” app to make everything work. This is the MOST EXPENSIVE app. I feel cheated and tricked. I requested for refund. They took their time (before signing up they responded in 24 hours) to reply despite many emails and always rejected my request saying their system is good enough for my company.";;;
"I pleaded many times to them to do the right thing, but they ignored all my request. We are a small company with 3 people working here and this was a huge loss for us. Despite knowing we won’t be able to use their system, they refused to give a refund and stuck with their narrative. I even requested them to get on a call with me and prove to me, that their system was good for my company but that too they refused and told me to learn myself. Complete change of attitude and terrible professionalism."",Nothing at all. Everything about this company is toxic.,Everything about this company is toxic.,Malaisie,positive,1.0,3";;;
"Utilisateur vérifié,Utilisateur LinkedIn vérifié,Cost effective tool to solve an extensive range of problems,il y a 8 mois,  + 1 ans,""While Odoo boasts a comprehensive range of functionalities that may fulfill all your needs, it is important to note that it comes with a substantial learning curve."",""I appreciate the comprehensive range of fields available by default for capturing information, as well as our flexibility to incorporate additional fields tailored to our project management needs and operational processes."",""The user interface can be somewhat discouraging, and there is a noticeable delay in operational speed when loading or navigating between screens."",,positive,1.0,3";;;
"Pedro,CEO & Founder (Portugal),Building our Client's base for the Future,il y a 6 mois,  6 à 12 mois,""For the price we pay, we are 100% happy with the solution."",The easy way to add information about clients and potencial leads. The score about,Nothing relevant on the platform that i dont like.,Portugal,positive,1.0,3";;;
"Frédéric,Employee (Belgique),We use this software to manage production and supplies. Great tool.,il y a 7 ans,  + 1 ans,Perfect tool for us in production and supply chain management,""This software is flexible, powerful, and shows an unbeatable ratio quality/price. I do recommend it."",Support is very hard to get these days. It used to be much better. It has become impossible to have support on the phone and reactions request for support are very slow.,Belgique,positive,1.0,3";;;
Usman,Lead Software Engineer (Pakistan),Best ERP,il y a 4 ans,  1 à 5 mois,amazing experience over other ERP,Module Base Approach Easy to Customization Easy to understand easy to integrate,odoo needs to improve manufacturing module that is not fit for all business.,Pakistan,positive,1.0,3;;;
"Nacho,CEO (Espagne),A good ERP for a very low investment with room for some users experience improvements,il y a 6 ans,  + 2 ans,Powerful complete ERP solution for a portion the cost of other similar solutions,""Web based, Flexibility, Easy to use, Continuous Improvements, Multi companies, Multi currencies, Domestic Legal Journals..."",Very little documentation of the product. When you make a mistake and want to fix that in the system is a total nightmare to undo errors.,Espagne,positive,1.0,3";;;
